{"schema":1,"metric":"val_bpb","baseline":"GPT2","rows":[{"label":"Bigram","source":"/home/reeler/nanoscope/nanoscope/baselines/tinystories-5min/bigram","seeds":[0,1,2],"params":262144,"params_kind":"total","tokens":1024000,"summary":{"n":3,"mean":1.739587557866606,"sample_sd":0.021398373383212013,"ci95_low":1.6864310515752545,"ci95_high":1.7927440641579575,"status":"estimated"},"delta":{"n":3,"mean":0.42428399957879837,"sample_sd":0.017877792395530806,"ci95_low":0.37987310128621704,"ci95_high":0.4686948978713797,"status":"estimated","paired":true},"verdict":"worse","text":{"params":"0.26M","tokens":"1.0M","value":"1.740 ± 0.053","delta":"+0.424 [+0.380, +0.469]","verdict":"worse","statement":"Bigram vs GPT2: +0.424 [+0.380, +0.469] bpb, 3 seeds each, paired"}},{"label":"Modern","source":"/home/reeler/nanoscope/nanoscope/baselines/tinystories-5min/modern","seeds":[0,1,2],"params":1250688,"params_kind":"total","tokens":1024000,"summary":{"n":3,"mean":1.1507585581405886,"sample_sd":0.004883649015616112,"ci95_low":1.1386269014499442,"ci95_high":1.162890214831233,"status":"estimated"},"delta":{"n":3,"mean":-0.16454500014721915,"sample_sd":0.004784297462624243,"ci95_low":-0.17642985389835544,"ci95_high":-0.15266014639608286,"status":"estimated","paired":true},"verdict":"better","text":{"params":"1.25M","tokens":"1.0M","value":"1.151 ± 0.012","delta":"−0.165 [−0.176, −0.153]","verdict":"better","statement":"Modern vs GPT2: −0.165 [−0.176, −0.153] bpb, 3 seeds each, paired"}},{"label":"GPT2","source":"/home/reeler/nanoscope/nanoscope/baselines/tinystories-5min/gpt2","seeds":[0,1,2],"params":1350400,"params_kind":"total","tokens":1024000,"summary":{"n":3,"mean":1.3153035582878077,"sample_sd":0.009368303904627246,"ci95_low":1.2920314012631853,"ci95_high":1.33857571531243,"status":"estimated"},"delta":null,"verdict":"baseline","text":{"params":"1.35M","tokens":"1.0M","value":"1.315 ± 0.023","delta":"(baseline)","verdict":"","statement":null}}],"notes":[],"curves":[{"label":"Bigram","source":"/home/reeler/nanoscope/nanoscope/baselines/tinystories-5min/bigram","seeds":[{"seed":0,"points":[[102400,2.876056061265161],[204800,2.485118839866353],[307200,2.1672132348897475],[409600,1.9525392694527475],[512000,1.83778478065708],[614400,1.7772581078221732],[716800,1.741521305805797],[819200,1.7269232717033607],[921600,1.7202479915971522],[1024000,1.7194336452262962]]},{"seed":1,"points":[[102400,2.867515365692937],[204800,2.4934395735524024],[307200,2.2051358397080043],[409600,2.011768884913463],[512000,1.8937777455046696],[614400,1.8258605734434166],[716800,1.7879640075006984],[819200,1.770360217231537],[921600,1.7629692606850982],[1024000,1.762044144125189]]},{"seed":2,"points":[[102400,2.863649999814092],[204800,2.476756934889296],[307200,2.1651659875932086],[409600,1.961274811754107],[512000,1.8520421056166627],[614400,1.7920721513396127],[716800,1.7590715737370866],[819200,1.7441790992563897],[921600,1.7381359013357869],[1024000,1.737284884248333]]}]},{"label":"Modern","source":"/home/reeler/nanoscope/nanoscope/baselines/tinystories-5min/modern","seeds":[{"seed":0,"points":[[102400,1.8653535677981445],[204800,1.4956365195593178],[307200,1.3852748484166164],[409600,1.305158993111795],[512000,1.260179404780601],[614400,1.2144176521360273],[716800,1.188322112594615],[819200,1.1671002026395922],[921600,1.1533475003301592],[1024000,1.152235384109203]]},{"seed":1,"points":[[102400,1.8551862606878056],[204800,1.512760078339789],[307200,1.3926403158929366],[409600,1.3176669694235261],[512000,1.2644956400420981],[614400,1.2260821202611782],[716800,1.1902698939058254],[819200,1.1690585045825086],[921600,1.1564982859752486],[1024000,1.154733346457048]]},{"seed":2,"points":[[102400,1.7958092497130114],[204800,1.4899844006747338],[307200,1.3638462581495194],[409600,1.2969926685051631],[512000,1.2505659196784014],[614400,1.2146916748176022],[716800,1.182862457949007],[819200,1.1599596515395798],[921600,1.1476852761467573],[1024000,1.1453069438555148]]}]},{"label":"GPT2","source":"/home/reeler/nanoscope/nanoscope/baselines/tinystories-5min/gpt2","seeds":[{"seed":0,"points":[[102400,1.8448434969932952],[204800,1.5521101811592155],[307200,1.489778493154181],[409600,1.4384617340573198],[512000,1.4089676452139086],[614400,1.372219474706432],[716800,1.3440580835651155],[819200,1.3290668699316446],[921600,1.315982086454271],[1024000,1.315497889444332]]},{"seed":1,"points":[[102400,1.845241283768934],[204800,1.5437896891832892],[307200,1.4799327433474876],[409600,1.4382931713182152],[512000,1.4142755212217226],[614400,1.3809053756493643],[716800,1.3547785868472892],[819200,1.3376380357316693],[921600,1.325826215781828],[1024000,1.3245731848285507]]},{"seed":2,"points":[[102400,1.7999928627150803],[204800,1.5463415137384044],[307200,1.465539640846796],[409600,1.4254099264225464],[512000,1.3973772969874207],[614400,1.3643918205936563],[716800,1.3404681917633754],[819200,1.3190482117101785],[921600,1.3078230954235641],[1024000,1.3058396005905404]]}]}],"precision_plan":{"metric":"val_bpb","preset":"tinystories-5min","n_seeds":3,"sd":0.013778068674582547,"half_width":0.03422661998961639,"source":"baselines/tinystories-5min","models":["bigram","gpt2","modern"],"text":"With 3 seeds per model, a difference on this preset is known to about ±0.034 bpb (from the shipped baselines' seed spread)."},"nanoscope":"0.4.0","title":"bits per byte on the first 200 validation documents of roneneldan/TinyStories (lower is better)","params_header":"total params"}